{
  "sessionId": "session-2026-06-14",
  "observedAt": "2026-06-14",
  "methodologyVersion": "collector-v3-route-aggregate",
  "collectedBy": "collect.mjs Playwright automated observation",
  "targetUrl": "https://momcozy.com",
  "metrics": {
    "lcp": null,
    "lcpNullReason": "lcp_unobserved_in_timeout",
    "fcp": 0.58,
    "ttfb": 416,
    "cls": 0,
    "tbt": 0,
    "domNodes": 7356,
    "longTasks": 3,
    "totalRequests": 504,
    "jsKb": 1904,
    "thirdPartyFailures": 45
  },
  "mobile": {
    "lcp": null,
    "lcpNullReason": "lcp_unobserved_in_timeout",
    "fcp": 0.34,
    "ttfb": 213,
    "cls": 0,
    "tbt": 0,
    "thirdPartyFailures": 44
  },
  "observations": [
    {
      "routeId": "homepage",
      "routeLabel": "Homepage",
      "routePath": "/",
      "viewport": "desktop",
      "metrics": {
        "lcp": null,
        "lcpNullReason": "lcp_unobserved_in_timeout",
        "fcp": 0.58,
        "ttfb": 416,
        "cls": 0,
        "tbt": 0,
        "domNodes": 7356,
        "longTasks": 3,
        "totalRequests": 504,
        "transferKb": 5289,
        "jsKb": 1904,
        "thirdPartyFailures": 45,
        "consoleErrors": 3,
        "pageErrors": 2,
        "loadEventMs": 4937,
        "scriptTags": 354,
        "iframeCount": 28,
        "imagesTotal": 352,
        "imagesWebp": 3,
        "imagesWebpPct": 0.85,
        "missingAlt": 5,
        "missingSrcset": 149,
        "aboveFoldImages": 7,
        "aboveFoldLazyImages": 5
      }
    },
    {
      "routeId": "homepage",
      "routeLabel": "Homepage",
      "routePath": "/",
      "viewport": "mobile",
      "metrics": {
        "lcp": null,
        "lcpNullReason": "lcp_unobserved_in_timeout",
        "fcp": 0.34,
        "ttfb": 213,
        "cls": 0,
        "tbt": 0,
        "domNodes": 8088,
        "longTasks": 3,
        "totalRequests": 579,
        "transferKb": 4868,
        "jsKb": 1905,
        "thirdPartyFailures": 44,
        "consoleErrors": 3,
        "pageErrors": 2,
        "loadEventMs": 4942,
        "scriptTags": 354,
        "iframeCount": 28,
        "imagesTotal": 444,
        "imagesWebp": 3,
        "imagesWebpPct": 0.68,
        "missingAlt": 5,
        "missingSrcset": 153,
        "aboveFoldImages": 22,
        "aboveFoldLazyImages": 11
      }
    },
    {
      "routeId": "product-detail",
      "routeLabel": "Representative product-detail route",
      "routePath": "/products/momcozy-kleanpal-pro-baby-bottle-washer",
      "viewport": "desktop",
      "metrics": {
        "lcp": null,
        "lcpNullReason": "lcp_unobserved_in_timeout",
        "fcp": 0.44,
        "ttfb": 233,
        "cls": 0,
        "tbt": 0,
        "domNodes": 7357,
        "longTasks": 2,
        "totalRequests": 571,
        "transferKb": 4280,
        "jsKb": 1942,
        "thirdPartyFailures": 56,
        "consoleErrors": 4,
        "pageErrors": 2,
        "loadEventMs": 4936,
        "scriptTags": 342,
        "iframeCount": 32,
        "imagesTotal": 334,
        "imagesWebp": 37,
        "imagesWebpPct": 11.08,
        "missingAlt": 40,
        "missingSrcset": 126,
        "aboveFoldImages": 17,
        "aboveFoldLazyImages": 15
      }
    },
    {
      "routeId": "product-detail",
      "routeLabel": "Representative product-detail route",
      "routePath": "/products/momcozy-kleanpal-pro-baby-bottle-washer",
      "viewport": "mobile",
      "metrics": {
        "lcp": null,
        "lcpNullReason": "lcp_unobserved_in_timeout",
        "fcp": 0.48,
        "ttfb": 298,
        "cls": 0,
        "tbt": 0,
        "domNodes": 8073,
        "longTasks": 3,
        "totalRequests": 641,
        "transferKb": 4417,
        "jsKb": 1942,
        "thirdPartyFailures": 55,
        "consoleErrors": 4,
        "pageErrors": 5,
        "loadEventMs": 4747,
        "scriptTags": 342,
        "iframeCount": 32,
        "imagesTotal": 426,
        "imagesWebp": 37,
        "imagesWebpPct": 8.69,
        "missingAlt": 40,
        "missingSrcset": 126,
        "aboveFoldImages": 25,
        "aboveFoldLazyImages": 14
      }
    }
  ],
  "routes": [
    {
      "routeId": "homepage",
      "label": "Homepage",
      "path": "/",
      "primary": true,
      "viewports": [
        {
          "label": "desktop",
          "width": 1440,
          "height": 900,
          "metrics": {
            "lcp": null,
            "lcpNullReason": "lcp_unobserved_in_timeout",
            "fcp": 0.58,
            "ttfb": 416,
            "cls": 0,
            "tbt": 0,
            "domNodes": 7356,
            "longTasks": 3,
            "totalRequests": 504,
            "transferKb": 5289,
            "jsKb": 1904,
            "thirdPartyFailures": 45,
            "consoleErrors": 3,
            "pageErrors": 2,
            "loadEventMs": 4937,
            "scriptTags": 354,
            "iframeCount": 28,
            "imagesTotal": 352,
            "imagesWebp": 3,
            "imagesWebpPct": 0.85,
            "missingAlt": 5,
            "missingSrcset": 149,
            "aboveFoldImages": 7,
            "aboveFoldLazyImages": 5
          }
        },
        {
          "label": "mobile",
          "width": 390,
          "height": 844,
          "metrics": {
            "lcp": null,
            "lcpNullReason": "lcp_unobserved_in_timeout",
            "fcp": 0.34,
            "ttfb": 213,
            "cls": 0,
            "tbt": 0,
            "domNodes": 8088,
            "longTasks": 3,
            "totalRequests": 579,
            "transferKb": 4868,
            "jsKb": 1905,
            "thirdPartyFailures": 44,
            "consoleErrors": 3,
            "pageErrors": 2,
            "loadEventMs": 4942,
            "scriptTags": 354,
            "iframeCount": 28,
            "imagesTotal": 444,
            "imagesWebp": 3,
            "imagesWebpPct": 0.68,
            "missingAlt": 5,
            "missingSrcset": 153,
            "aboveFoldImages": 22,
            "aboveFoldLazyImages": 11
          }
        }
      ]
    },
    {
      "routeId": "product-detail",
      "label": "Representative product-detail route",
      "path": "/products/momcozy-kleanpal-pro-baby-bottle-washer",
      "primary": false,
      "viewports": [
        {
          "label": "desktop",
          "width": 1440,
          "height": 900,
          "metrics": {
            "lcp": null,
            "lcpNullReason": "lcp_unobserved_in_timeout",
            "fcp": 0.44,
            "ttfb": 233,
            "cls": 0,
            "tbt": 0,
            "domNodes": 7357,
            "longTasks": 2,
            "totalRequests": 571,
            "transferKb": 4280,
            "jsKb": 1942,
            "thirdPartyFailures": 56,
            "consoleErrors": 4,
            "pageErrors": 2,
            "loadEventMs": 4936,
            "scriptTags": 342,
            "iframeCount": 32,
            "imagesTotal": 334,
            "imagesWebp": 37,
            "imagesWebpPct": 11.08,
            "missingAlt": 40,
            "missingSrcset": 126,
            "aboveFoldImages": 17,
            "aboveFoldLazyImages": 15
          }
        },
        {
          "label": "mobile",
          "width": 390,
          "height": 844,
          "metrics": {
            "lcp": null,
            "lcpNullReason": "lcp_unobserved_in_timeout",
            "fcp": 0.48,
            "ttfb": 298,
            "cls": 0,
            "tbt": 0,
            "domNodes": 8073,
            "longTasks": 3,
            "totalRequests": 641,
            "transferKb": 4417,
            "jsKb": 1942,
            "thirdPartyFailures": 55,
            "consoleErrors": 4,
            "pageErrors": 5,
            "loadEventMs": 4747,
            "scriptTags": 342,
            "iframeCount": 32,
            "imagesTotal": 426,
            "imagesWebp": 37,
            "imagesWebpPct": 8.69,
            "missingAlt": 40,
            "missingSrcset": 126,
            "aboveFoldImages": 25,
            "aboveFoldLazyImages": 14
          }
        }
      ]
    }
  ],
  "confidence": "low",
  "notes": "Automated collection. Routes: homepage, product-detail. Desktop: LCP N/As, FCP 0.58s, TTFB 416ms, 3P failures 45. Mobile: LCP N/As, FCP 0.34s, 3P failures 44."
}
